{
  "$schema": "../../schema/z3-room.schema.json",
  "id": 29,
  "name": "Lake Hylia Inlet",
  "roomType": "Overworld",
  "nodes": [
    {
      "id": 1,
      "name": "Main Area",
      "world": "both",
      "transitions": [
        {"edge": "north", "span": [7, 10]},
        {"edge": "west", "span": [7, 13]}
      ],
      "entrances": [
        {
          "id": 1,
          "name": "Lake Hylia Inlet Great Fairy",
          "world": "light"
        },
        {
          "id": 2,
          "name": "Ice Lake Inlet Great Fairy",
          "world": "dark"
        }
      ]
    },
    {
      "id": 2,
      "name": "South East Edge",
      "world": "both",
      "transitions": [
        {"edge": "south", "span": [25, 27]}
      ]
    },
    {
      "id": 3,
      "name": "River",
      "world": "both",
      "transitions": [
        {"edge": "south", "span": [19.5, 22.5], "terrain": "water"},
        {"edge": "west", "span": [16.5, 25], "terrain": "water"}
      ]
    }
  ],
  "strats": [
    {
      "link": [1, 2],
      "name": "Base",
      "world": "any",
      "requires": []
    },
    {
      "link": [2, 1],
      "name": "Base",
      "world": "light",
      "requires": []
    },
    {
      "link": [2, 1],
      "name": "Base",
      "world": "dark",
      "requires": [
        {"or": [
          {"sword": 1},
          "Boomerang",
          "Hookshot",
          {"arrows": 2},
          {"silverArrows": 1},
          {"rod": 1},
          {"combatProficiency": 2},
          {"damage": {"enemy": "Ropa", "count": 1}}
        ]}
      ]
    }
  ]
}