{
  "$schema": "../../schema/z3-room.schema.json",
  "id": 3,
  "name": "Tower of Hera",
  "roomType": "Overworld",
  "nodes": [
    {
      "id": 1,
      "name": "Mountain Entrance Cave",
      "world": "both",
      "entrances": [
        {
          "id": 1,
          "name": "Old Man Cave",
          "world": "light"
        },
        {
          "id": 2,
          "name": "Dark Death Mountain Great Fairy",
          "world": "dark"
        }
      ]
    },
    {
      "id": 2,
      "name": "Old Man's House",
      "world": "both",
      "entrances": [
        {
          "id": 1,
          "name": "Old Man's House Entrance",
          "world": "light"
        }
      ]
    },
    {
      "id": 3,
      "name": "Old Man's House Back Entrance",
      "world": "both",
      "entrances": [
        {
          "id": 1,
          "name": "Old Man's House Back Entrance",
          "world": "light"
        }
      ]
    },
    {
      "id": 4,
      "name": "Lower East Edge",
      "world": "both",
      "transitions": [
        {"edge": "east", "span": [50, 56]}
      ]
    },
    {
      "id": 5,
      "name": "Long Staircase",
      "world": "dark",
      "entrances": [
        {
          "id": 1,
          "name": "Death Mountain Return Cave",
          "world": "light"
        }
      ]
    },
    {
      "id": 6,
      "name": "South of Spectacle Rock Peak",
      "world": "both",
      "entrances": [
        {
          "id": 1,
          "name": "Spectacle Rock Top Entrance",
          "world": "light"
        }
      ]
    },
    {
      "id": 7,
      "name": "Dark World Portal",
      "world": "both"
    },
    {
      "id": 8,
      "name": "On Spectacle Rock Peak",
      "world": "both"
    },
    {
      "id": 9,
      "name": "Upper Main Area",
      "world": "both",
      "transitions": [
        {"edge": "east", "span": [7, 9]}
      ],
      "entrances": [
        {
          "id": 1,
          "name": "Tower of Hera Entrance",
          "world": "light"
        },
        {
          "id": 2,
          "name": "Ganon's Tower Entrance",
          "world": "dark"
        }
      ]
    },
    {
      "id": 10,
      "name": "Left Balcony",
      "world": "light",
      "entrances": [
        {
          "id": 1,
          "name": "Spectacle Rock Bottom Left Entrance",
          "world": "light"
        }
      ]
    },
    {
      "id": 11,
      "name": "Middle Balcony",
      "world": "light",
      "entrances": [
        {
          "id": 1,
          "name": "Spectacle Rock Bottom Right Entrance",
          "world": "light"
        }
      ]
    },
    {
      "id": 12,
      "name": "Far Right Balcony",
      "world": "both",
      "entrances": [
        {
          "id": 1,
          "name": "Spike Cave Entrance",
          "world": "dark"
        }
      ]
    }
  ],
  "items": [
    {
      "id": 1,
      "locationName": "Rescue Old Man",
      "itemLocation": 2,
      "item": "MagicMirror",
      "itemAddress": "0xF69FA"
    },
    {
      "id": 2,
      "locationName": "Spectacle Rock Item",
      "itemLocation": 8,
      "world": "light",
      "item": "PieceOfHeart",
      "itemAddress": "0x180140"
    },
    {
      "id": 3,
      "locationName": "Ether Tablet",
      "itemLocation": 9,
      "world": "light",
      "item": "Ether",
      "itemAddress": "0x180016"
    }
  ],
  "strats": [
    {
      "link": [1, 2],
      "name": "Base",
      "world": "light",
      "requires": [
        {"or": [
          {"damage": {"enemy": "Deadrock", "count": 2}},
          {"and": [
            {"combatProficiency": 2},
            {"damage": {"enemy": "Deadrock", "count": 1}}
          ]},
          {"combatProficiency": 3}
        ]}
      ]
    },
    {
      "link": [1, 2],
      "name": "Invincibility",
      "world": "light",
      "requires": [
        {"combatProficiency": 2},
        {"or": [
          {"blueCane": 32},
          {"cape": 35}
        ]}
      ]
    },
    {
      "link": [1, 2],
      "name": "Base",
      "world": "dark",
      "requires": []
    },
    {
      "link": [2, 1],
      "name": "Base",
      "world": "light",
      "requires": [
        {"or": [
          {"damage": {"enemy": "Deadrock", "count": 2}},
          {"and": [
            {"combatProficiency": 2},
            {"damage": {"enemy": "Deadrock", "count": 1}}
          ]},
          {"combatProficiency": 3}
        ]}
      ]
    },
    {
      "link": [2, 1],
      "name": "Invincibility",
      "world": "light",
      "requires": [
        {"combatProficiency": 2},
        {"or": [
          {"blueCane": 32},
          {"cape": 35}
        ]}
      ]
    },
    {
      "link": [2, 1],
      "name": "Base",
      "world": "dark",
      "requires": []
    },
    {
      "link": [2, 2],
      "name": "Rescue Old Man",
      "world": "light",
      "requires": [
        {"follower": "Old Man"}
      ],
      "collectsItems": [1],
      "FollowerComplete": "Old Man"
    },
    {
      "link": [2, 3],
      "name": "Base",
      "world": "light",
      "requires": [
        {"or": [
          {"damage": {"enemy": "Falling Boulder", "count": 1}},
          {"combatProficiency": 2}
        ]}
      ]
    },
    {
      "link": [2, 3],
      "name": "Base",
      "world": "dark",
      "requires": []
    },
    {
      "link": [3, 2],
      "name": "Base",
      "world": "any",
      "requires": []
    },
    {
      "link": [3, 4],
      "name": "Base",
      "world": "light",
      "requires": [
        {"or": [
          {"damage": {"enemy": "Deadrock", "count": 2}},
          {"combatProficiency": 3}
        ]}
      ]
    },
    {
      "link": [3, 4],
      "name": "Base",
      "world": "dark",
      "requires": []
    },
    {
      "link": [3, 5],
      "name": "Base",
      "world": "any",
      "requires": []
    },
    {
      "link": [4, 2],
      "name": "Base",
      "world": "any",
      "requires": []
    },
    {
      "link": [5, 1],
      "name": "Base",
      "world": "any",
      "requires": []
    },
    {
      "link": [5, 3],
      "name": "Base",
      "world": "any",
      "requires": []
    },
    {
      "link": [5, 6],
      "name": "Base",
      "world": "light",
      "requires": [
        {"or": [
          {"sword": 1},
          {"combatProficiency": 2},
          "h_NoAgahnimLoophole",
          {"arrows": 2},
          {"silverArrows": 2},
          {"rod": 2}
        ]}
      ]
    },
    {
      "link": [5, 6],
      "name": "Base",
      "world": "dark",
      "requires": []
    },
    {
      "link": [5, 10],
      "name": "Base",
      "world": "light",
      "requires": []
    },
    {
      "link": [6, 5],
      "name": "Base",
      "world": "any",
      "requires": []
    },
    {
      "link": [6, 7],
      "name": "Base",
      "world": "any",
      "requires": []
    },
    {
      "link": [6, 8],
      "name": "Base",
      "world": "dark",
      "requires": []
    },
    {
      "link": [6, 10],
      "name": "Base",
      "world": "light",
      "requires": []
    },
    {
      "link": [6, 11],
      "name": "Base",
      "world": "light",
      "requires": []
    },
    {
      "link": [7, 6],
      "name": "Base",
      "world": "any",
      "requires": []
    },
    {
      "link": [7, 12],
      "name": "Base",
      "world": "any",
      "requires": []
    },
    {
      "link": [8, 6],
      "name": "Base",
      "world": "dark",
      "requires": []
    },
    {
      "link": [8, 8],
      "name": "Base - Collect Item",
      "world": "light",
      "requires": [],
      "collectsItems": [2]
    },
    {
      "link": [8, 9],
      "name": "Base",
      "world": "light",
      "requires": []
    },
    {
      "link": [9, 5],
      "name": "Base",
      "world": "any",
      "requires": []
    },
    {
      "link": [9, 7],
      "name": "Base",
      "world": "any",
      "requires": []
    },
    {
      "link": [9, 9],
      "name": "Ether Tablet",
      "world": "light",
      "requires": [
        {"sword": 2},
        "BookOfMudora"
      ],
      "collectsItems": [3]
    },
    {
      "link": [10, 5],
      "name": "Base",
      "world": "light",
      "requires": []
    },
    {
      "link": [11, 5],
      "name": "Base",
      "world": "light",
      "requires": []
    },
    {
      "link": [12, 3],
      "name": "Base",
      "world": "any",
      "requires": []
    }
  ]
}