{
  "$schema": "../../schema/z3-room.schema.json",
  "id": 32,
  "name": "Cave 45",
  "roomType": "Overworld",
  "nodes": [
    {
      "id": 1,
      "name": "Main Area",
      "world": "both",
      "transitions": [
        {"edge": "north", "span": [3, 7.5]},
        {"edge": "east", "span": [5.5, 29]}
      ]
    },
    {
      "id": 2,
      "name": "North Bush Blocked Area",
      "world": "both",
      "transitions": [
        {"edge": "north", "span": [13.5, 16.5]}
      ]
    },
    {
      "id": 3,
      "name": "Cave 45 Ledge",
      "world": "both",
      "entrances": [
        {
          "id": 1,
          "name": "Cave 45 Entrance",
          "world": "light"
        }
      ]
    }
  ],
  "strats": [
    {
      "link": [1, 1],
      "name": "Bonk Fairy",
      "world": "light",
      "requires": [
        "PegasusBoots",
        {"refill": {"type": "Fairy", "limit": 1}}
      ],
      "note": ["The southeast tree will release a fairy when dashed into."]
    },
    {
      "link": [1, 2],
      "name": "Base",
      "world": "any",
      "requires": [
        {"glove": 0}
      ]
    },
    {
      "link": [2, 1],
      "name": "Base",
      "world": "any",
      "requires": [
        {"glove": 0}
      ]
    },
    {
      "link": [1, 3],
      "name": "Base",
      "world": "dark",
      "requires": []
    }
  ]
}