{
  "$schema": "../../schema/z3-room.schema.json",
  "id": 35,
  "name": "Lake Hylia",
  "roomType": "Overworld",
  "nodes": [
    {
      "id": 1,
      "name": "Northwest Area",
      "world": "both",
      "transitions": [
        {"edge": "north", "span": [8, 21]}
      ],
      "entrances": [
        {
          "id": 1,
          "name": "Lake Hylia Fortune Teller",
          "world": "light"
        },
        {
          "id": 2,
          "name": "Lake Hylia Shop",
          "world": "light"
        },
        {
          "id": 3,
          "name": "Ice Lake Shop",
          "world": "dark"
        }
      ]
    },
    {
      "id": 2,
      "name": "Northeast Area",
      "world": "both",
      "transitions": [
        {"edge": "north", "span": [57, 59]}
      ]
    },
    {
      "id": 3,
      "name": "Southeast Area",
      "world": "both",
      "transitions": [
        {"edge": "east", "span": [55.5, 61]}
      ]
    },
    {
      "id": 4,
      "name": "Southwest Area",
      "world": "both",
      "transitions": [
        {"edge": "west", "span": [56, 61]}
      ]
    },
    {
      "id": 5,
      "name": "Southwest Bombable Entrance",
      "world": "light",
      "entrances": [
        {
          "id": 1,
          "name": "Mini Moldorm Cave Entrance",
          "world": "light"
        }
      ]
    },
    {
      "id": 6,
      "name": "Water",
      "world": "both",
      "transitions": [
        {"edge": "north", "span": [51.5, 54.5], "terrain": "water"},
        {"edge": "east", "span": [50.5, 53.5], "terrain": "water"}
      ],
      "teleports": [
        {
          "id": 1,
          "name": "Lake Hylia Whirlpool",
          "world": "light"
        }
      ]
    },
    {
      "id": 7,
      "name": "Lake Hylia Main Island",
      "world": "both",
      "entrances": [
        {
          "id": 1,
          "name": "Lake Hylia Great Fairy",
          "world": "light"
        },
        {
          "id": 2,
          "name": "Ice Palace Entrance",
          "world": "dark"
        }
      ]
    },
    {
      "id": 8,
      "name": "Lake Hylia Small Island",
      "world": "both"
    }
  ],
  "items": [
    {
      "id": 1,
      "locationName": "Lake Hylia Island Item",
      "itemLocation": 3,
      "world": "light",
      "item": "PieceOfHeart",
      "itemAddress": "0x180144"
    }
  ],
  "lockedDoors": [
    {
      "id": 1,
      "locationName": "Southwest Bombable Wall",
      "world": "light",
      "doorPosition": "north",
      "doorLocation": 4,
      "keyType": "bomb"
    }
  ],
  "strats": [
    {
      "link": [1, 6],
      "name": "Base",
      "world": "any",
      "requires": [
        "Flippers"
      ]
    },
    {
      "link": [2, 6],
      "name": "Base",
      "world": "any",
      "requires": [
        "Flippers"
      ]
    },
    {
      "link": [3, 4],
      "name": "Base",
      "world": "light",
      "requires": []
    },
    {
      "link": [3, 6],
      "name": "Base",
      "world": "any",
      "requires": [
        "Flippers"
      ]
    },
    {
      "link": [4, 3],
      "name": "Base",
      "world": "light",
      "requires": []
    },
    {
      "link": [4, 4],
      "name": "Base - Bomb Wall",
      "world": "light",
      "requires": [
        {"bombs": 1}
      ],
      "unlocksDoor": [1]
    },
    {
      "link": [4, 5],
      "name": "Base - Already Opened",
      "world": "light",
      "requires": [
        {"unlockDoor": 1}
      ]
    },
    {
      "link": [4, 6],
      "name": "Base",
      "world": "any",
      "requires": [
        "Flippers"
      ]
    },
    {
      "link": [5, 4],
      "name": "Base",
      "world": "light",
      "requires": []
    },
    {
      "link": [6, 1],
      "name": "Base",
      "world": "light",
      "requires": []
    },
    {
      "link": [6, 2],
      "name": "Base",
      "world": "any",
      "requires": []
    },
    {
      "link": [6, 7],
      "name": "Base",
      "world": "light",
      "requires": []
    },
    {
      "link": [6, 8],
      "name": "Base",
      "world": "dark",
      "requires": [
        "Flippers",
        {"or": [
          {"combatProficiency": 2},
          {"damage": {"enemy": "Zirro (Green)", "count": 1}}
        ]}
      ],
      "devNote": [
        "FIXME: It looks like fake flippers wont let Link stand on the shallow water to teleport. Double check this.",
        "If that's not the case, then the whirlpool logic needs to be checked, since its surrounded by shallow water."
      ]
    },
    {
      "link": [7, 6],
      "name": "Base",
      "world": "light",
      "requires": [
        "Flippers"
      ]
    },
    {
      "link": [7, 7],
      "fromWorld": "light",
      "toWorld": "dark",
      "name": "Dark World Portal",
      "requires": [
        {"glove": 2}
      ]
    },
    {
      "link": [8, 6],
      "name": "Base",
      "world": "any",
      "requires": [
        "Flippers"
      ]
    },
    {
      "link": [8, 8],
      "name": "Base - Collect Item",
      "world": "light",
      "requires": [],
      "collectsItems": [1]
    }
  ]
}